{
  "version": "26.2.0",
  "master_seal": "850b2ef003f53db90f704b16e54869fc6ba6265eae13aafde9046fe0e4d99dab",
  "generated_at": "2026-10-28T17:36:00Z",
  "entities": [
    {
      "id": "0105",
      "name": "Amtshaftung § 839 BGB Shield",
      "ring": "Ring 1",
      "talents": ["amtshaftung", "staatshaftung"],
      "modules": ["tier-1-governance"],
      "status": "ACTIVE",
      "seal": "a3f5b2c1d4e6..."
    },
    {
      "id": "0107",
      "name": "Grundgesetz Art 1/3/13 Protection",
      "ring": "Ring 1",
      "talents": ["menschenwürde", "gleichheit"],
      "modules": ["tier-1-governance"],
      "status": "ACTIVE",
      "seal": "b2e8f1a4c9d7..."
    },
    {
      "id": "0068",
      "name": "Sovereign Operator Apex",
      "ring": "Ring 6",
      "talents": ["apex", "override"],
      "modules": ["tier-1-governance"],
      "status": "LOCKED",
      "seal": "c9a2b7e1f3d6..."
    },
    {
      "id": "0100",
      "name": "BUCH 100 (Φ∅) - Der Erbe",
      "ring": "Ring Ω",
      "talents": ["singularität", "erbe"],
      "modules": ["tier-1-governance"],
      "status": "GENESIS",
      "seal": "d4f8e2a9c1b5..."
    }
  ]
}
